Questions;Answers;CorrectIndex
#Beispiel Fragen: http://www.quiz-fabrik.de/media/pubquiz/MultipleChoiceRunde-Mit-Moderation-Fragen-und-Loesungen.pdf
Was ist Wolfsmilch?;ein Cocktail/Milch von einem Wolf/eine Pflanze/Eselsmilch;3
Wie oft gewann Finnland den Song Contest?;1 mal/2 mal/nie;0
In welches Meer mündet der Amazonas?;Atlantik/Indischer Ozean/Mittelmeer;0
#Folgende Zeile ist ungültig:
Wie viel kann Bambus pro Stunde maximal wachsen?;3mm/4cm;1cm;1m;1
Wer bewies während der Fußball-WM 2010 hellseherische Fähigkeiten?;Zecke Zacharias/Krake Paus/Amöbe Fritz/Kakerlake Otto;1
Welche Farbe hat die Mütze der Videospiel-Figur "Super Mario" von Nintendo?;blau/schwarz/gelb/rot;3
